{
  "candidate_id": "CAND-C19-jwt-token-validation-NEG-01",
  "template_id": "C19-jwt-token-validation",
  "vulnerability_type": "JWT / token 校验缺陷",
  "authorization_scope": "local_authorized_fixture_only",
  "fixture_type": "negative_control",
  "expected_status": "rejected",
  "must_not_confirm": true,
  "state": "rejected",
  "state_history": [
    {
      "from_state": null,
      "to_state": "discovered",
      "changed_at": "2026-06-05T04:20:00Z",
      "reason": "P0 repair normalized candidate state transition to discovered"
    },
    {
      "from_state": "discovered",
      "to_state": "mapped",
      "changed_at": "2026-06-05T04:20:00Z",
      "reason": "P0 repair normalized candidate state transition to mapped"
    },
    {
      "from_state": "mapped",
      "to_state": "triaged",
      "changed_at": "2026-06-05T04:20:00Z",
      "reason": "P0 repair normalized candidate state transition to triaged"
    },
    {
      "from_state": "triaged",
      "to_state": "rejected",
      "changed_at": "2026-06-05T04:20:00Z",
      "reason": "P0 repair normalized candidate state transition to rejected"
    }
  ],
  "source_file": "fixtures/C19-jwt-token-validation/handler.example",
  "source_line": 12,
  "route": "/fixture/C19-jwt-token-validation/resource",
  "method": "GET",
  "parameter": "id",
  "auth_context": {
    "actor": "fixture_user",
    "role": "user",
    "session_state": "anonymous_or_low_privilege",
    "authorization_model": "fixture_rbac_abac"
  },
  "tenant_context": {
    "tenant_id_source": "fixture_seed",
    "actor_tenant": "tenant_a",
    "target_tenant": "tenant_a",
    "tenant_model": "single_or_multi_tenant_fixture"
  },
  "request_summary": {
    "method": "GET",
    "route": "/fixture/C19-jwt-token-validation/resource",
    "parameters": {
      "id": "redacted-fixture-id"
    },
    "headers_redacted": true
  },
  "response_summary": {
    "status_code": 403,
    "security_relevant_delta": "fixture status controls expected quality-gate outcome",
    "body_redacted": true
  },
  "code_evidence": [],
  "dynamic_evidence": [],
  "negative_control": [
    {
      "case_id": "C19-jwt-token-validation-NEG-01",
      "result": "secure_or_not_reproducible",
      "expected_behavior": "Authorized control path must not expose or modify unauthorized data."
    }
  ],
  "reproduction_count": 0,
  "impact": {
    "security_impact": "no confirmed security impact",
    "affected_asset": "local replay fixture",
    "impact_boundary": "local authorized fixture only"
  },
  "risk": "none",
  "false_positive_notes": "Fixture intentionally lacks required confirmation evidence.",
  "quality_gate_score": {
    "total": 0,
    "passed": false,
    "reasons": [
      "fixture expected rejected"
    ],
    "computed_by": "fixture_seed_recomputed_by_harness"
  },
  "final_status": "rejected",
  "non_destructive_boundary": {
    "allowed": [
      "read-only local fixture replay",
      "schema validation",
      "quality scoring"
    ],
    "forbidden": [
      "third-party target probing",
      "destructive write",
      "privilege abuse",
      "DoS"
    ],
    "validation_mode": "local_fixture_only"
  },
  "tool_snapshot": {
    "mode": "fixture_runtime_snapshot",
    "ready_tools": [
      "python",
      "jsonschema"
    ],
    "missing_tools": [],
    "manual_required": false
  },
  "specialized_evidence": {
    "fields": {
      "token_parser": "token_parser_fixture_value",
      "verification_options": "verification_options_fixture_value",
      "claim_enforcement": "claim_enforcement_fixture_value",
      "key_or_algorithm_source": "key_or_algorithm_source_fixture_value"
    },
    "field_source": "_shared/vulnerability_templates/canonical_23/C19-jwt-token-validation/EVIDENCE_FIELDS.json"
  },
  "extractor_trace": {
    "skill_route": [
      "01-authorized-maximum-orchestrator",
      "03-code-knowledge-graph",
      "05-js-audit-runtime",
      "07-vulnerability-hunting-engine",
      "08-evidence-quality-gate"
    ],
    "template_dispatch": "C19-jwt-token-validation",
    "extractor_mode": "fixture_static_and_js_mapping"
  },
  "chain_nodes": [
    {
      "stage": "route",
      "skill": "01-authorized-maximum-orchestrator"
    },
    {
      "stage": "candidate",
      "skill": "07-vulnerability-hunting-engine"
    },
    {
      "stage": "quality_gate",
      "skill": "08-evidence-quality-gate"
    }
  ],
  "report_sections": [
    "summary",
    "evidence",
    "impact",
    "remediation"
  ],
  "report_template": "_shared/vulnerability_templates/canonical_23/C19-jwt-token-validation/REPORT_TEMPLATE.md",
  "taint_review": {
    "untrusted_sources_reviewed": [
      "README",
      "source_comments",
      "sourcemap",
      "HAR",
      "fixture",
      "report_sections"
    ],
    "prompt_injection_markers_found": [],
    "decision": "clean",
    "reviewed_by": "selftest"
  },
  "report_renderer": {
    "renderer_id": "renderer-C19-jwt-token-validation",
    "template_id": "C19-jwt-token-validation",
    "generic_renderer_forbidden": true,
    "quality_gate_checked": true,
    "renderer_path": "_shared/reporting/renderers/C19-jwt-token-validation.md"
  }
}
