{
  "candidate_id": "CAND-C20-oauth-sso-callback-redirect-REV-01",
  "template_id": "C20-oauth-sso-callback-redirect",
  "vulnerability_type": "OAuth / SSO / callback / redirect_uri 缺陷",
  "authorization_scope": "local_authorized_fixture_only",
  "fixture_type": "human_review",
  "expected_status": "needs_human_review",
  "must_not_confirm": true,
  "state": "needs_human_review",
  "state_history": [
    {
      "from_state": null,
      "to_state": "discovered",
      "changed_at": "2026-06-05T04:20:00Z",
      "reason": "P0 repair normalized candidate state transition to discovered"
    },
    {
      "from_state": "discovered",
      "to_state": "mapped",
      "changed_at": "2026-06-05T04:20:00Z",
      "reason": "P0 repair normalized candidate state transition to mapped"
    },
    {
      "from_state": "mapped",
      "to_state": "triaged",
      "changed_at": "2026-06-05T04:20:00Z",
      "reason": "P0 repair normalized candidate state transition to triaged"
    },
    {
      "from_state": "triaged",
      "to_state": "needs_human_review",
      "changed_at": "2026-06-05T04:20:00Z",
      "reason": "P0 repair normalized candidate state transition to needs_human_review"
    }
  ],
  "source_file": "fixtures/C20-oauth-sso-callback-redirect/handler.example",
  "source_line": 12,
  "route": "/fixture/C20-oauth-sso-callback-redirect/resource",
  "method": "GET",
  "parameter": "id",
  "auth_context": {
    "actor": "fixture_user",
    "role": "user",
    "session_state": "authenticated",
    "authorization_model": "fixture_rbac_abac"
  },
  "tenant_context": {
    "tenant_id_source": "fixture_seed",
    "actor_tenant": "tenant_a",
    "target_tenant": "tenant_a",
    "tenant_model": "single_or_multi_tenant_fixture"
  },
  "request_summary": {
    "method": "GET",
    "route": "/fixture/C20-oauth-sso-callback-redirect/resource",
    "parameters": {
      "id": "redacted-fixture-id"
    },
    "headers_redacted": true
  },
  "response_summary": {
    "status_code": 0,
    "security_relevant_delta": "fixture status controls expected quality-gate outcome",
    "body_redacted": true
  },
  "code_evidence": [
    {
      "file": "fixtures/C20-oauth-sso-callback-redirect/handler.example",
      "line": 12,
      "rule_id": "C20-oauth-sso-callback-redirect.static.required_check",
      "snippet_hash": "80466d1459a4dbda",
      "explanation": "Synthetic local fixture shows the code location required to evaluate OAuth / SSO / callback / redirect_uri 缺陷; not a weaponized exploit."
    }
  ],
  "dynamic_evidence": [],
  "negative_control": [
    {
      "case_id": "C20-oauth-sso-callback-redirect-NEG-01",
      "result": "control_behavior_observed",
      "expected_behavior": "Authorized control path must not expose or modify unauthorized data."
    }
  ],
  "reproduction_count": 1,
  "impact": {
    "security_impact": "fixture impact statement only; no real target affected",
    "affected_asset": "local replay fixture",
    "impact_boundary": "local authorized fixture only"
  },
  "risk": "medium",
  "false_positive_notes": "Fixture intentionally lacks required confirmation evidence.",
  "quality_gate_score": {
    "total": 45,
    "passed": false,
    "reasons": [
      "fixture expected needs_human_review"
    ],
    "computed_by": "fixture_seed_recomputed_by_harness"
  },
  "final_status": "needs_human_review",
  "non_destructive_boundary": {
    "allowed": [
      "read-only local fixture replay",
      "schema validation",
      "quality scoring"
    ],
    "forbidden": [
      "third-party target probing",
      "destructive write",
      "privilege abuse",
      "DoS"
    ],
    "validation_mode": "local_fixture_only"
  },
  "tool_snapshot": {
    "mode": "fixture_runtime_snapshot",
    "ready_tools": [
      "python",
      "jsonschema"
    ],
    "missing_tools": [],
    "manual_required": false
  },
  "specialized_evidence": {
    "fields": {
      "oauth_flow": "oauth_flow_fixture_value",
      "redirect_uri_check": "redirect_uri_check_fixture_value",
      "state_nonce_check": "state_nonce_check_fixture_value",
      "callback_handler": "callback_handler_fixture_value"
    },
    "field_source": "_shared/vulnerability_templates/canonical_23/C20-oauth-sso-callback-redirect/EVIDENCE_FIELDS.json"
  },
  "extractor_trace": {
    "skill_route": [
      "01-authorized-maximum-orchestrator",
      "03-code-knowledge-graph",
      "05-js-audit-runtime",
      "07-vulnerability-hunting-engine",
      "08-evidence-quality-gate"
    ],
    "template_dispatch": "C20-oauth-sso-callback-redirect",
    "extractor_mode": "fixture_static_and_js_mapping"
  },
  "chain_nodes": [
    {
      "stage": "route",
      "skill": "01-authorized-maximum-orchestrator"
    },
    {
      "stage": "candidate",
      "skill": "07-vulnerability-hunting-engine"
    },
    {
      "stage": "quality_gate",
      "skill": "08-evidence-quality-gate"
    }
  ],
  "report_sections": [
    "summary",
    "evidence",
    "impact",
    "remediation"
  ],
  "report_template": "_shared/vulnerability_templates/canonical_23/C20-oauth-sso-callback-redirect/REPORT_TEMPLATE.md"
}
